{
  "id": "volatile",
  "project_id": "fixture-missing_site",
  "model_version": "fixture",
  "ruleset_version": "volatile",
  "created_at": "2000-01-01T00:00:00+00:00",
  "summary": {
    "pass": 13,
    "fail": 0,
    "unverifiable": 10,
    "not_applicable": 21,
    "advisory": 0
  },
  "results": [
    {
      "rule_id": "pmc.tod.max-fsi",
      "title": "Maximum total FSI in the TOD zone",
      "severity": "critical",
      "element": null,
      "status": "unverifiable",
      "measured": null,
      "limit": null,
      "message": "Cannot verify: needs site.edges, project.overlays.metro_tod",
      "missing_inputs": [
        "site.edges",
        "project.overlays.metro_tod"
      ],
      "facts_used": [
        {
          "path": "project.overlays.metro_tod",
          "value": null,
          "source": "default"
        }
      ],
      "clause": {
        "ref": "14.2.1.2",
        "excerpt": "The maximum permissible total FSI in TOD zone shall be 4.00 including the base permissible FSI, subject to condition that, the additional FSI over and above the base permissible FSI shall be allowed within the overall limit of maximum permissible FSI, as given in the Table below.",
        "source": "udcpr2020 p.266",
        "retrieved": "2026-10-19"
      },
      "rule_status": "draft",
      "freshness": {
        "status": "unchecked",
        "url": null,
        "checked": null
      },
      "fix_by": null,
      "guidance_note": null
    },
    {
      "rule_id": "udcpr2020.ch6.congested-front-setback",
      "title": "Front setback from each road (congested area)",
      "severity": "critical",
      "element": null,
      "status": "unverifiable",
      "measured": null,
      "limit": null,
      "message": "Cannot verify: needs site.boundary, site.edges",
      "missing_inputs": [
        "site.boundary",
        "site.edges"
      ],
      "facts_used": [],
      "clause": {
        "ref": "Table No. 6-B (Regulation 6.1.1 ii)",
        "excerpt": "The minimum front setback from the existing or proposed road / roads shall be as per the following Table No.6-B. Streets 4.5 m. to less than 6.0 m.: NIL (mixed use 1.50 m.); 6.0 m. to less than 12.0 m.: 1.00 m. (2.00 m.); 12.0 m. and above: 2.00 m. (2.50 m.).",
        "source": "udcpr2020 p.106",
        "retrieved": "2026-10-19"
      },
      "rule_status": "draft",
      "freshness": {
        "status": "unchecked",
        "url": null,
        "checked": null
      },
      "fix_by": null,
      "guidance_note": null
    },
    {
      "rule_id": "udcpr2020.ch6.front-margin",
      "title": "Front setback from each road (non-congested area)",
      "severity": "critical",
      "element": null,
      "status": "unverifiable",
      "measured": null,
      "limit": null,
      "message": "Cannot verify: needs site.boundary, site.edges",
      "missing_inputs": [
        "site.boundary",
        "site.edges"
      ],
      "facts_used": [],
      "clause": {
        "ref": "Table No. 6-D (Regulation 6.2.1)",
        "excerpt": "Min. setback from road side / Min. side margins / Min. rear margins: roads of width 30.0 m. and above 6.0 (A, B, C class Municipal Corporations) / 3.0 / 3.0; 18.0 m. and above but below 30.0 m. 4.5 / 2.0 / 2.0; 15.0 m. and above but below 18.0 m. 3.0 / 1.5 / 1.5; less than 15.0 m. 3.0 / 1.5 / 1.5.",
        "source": "udcpr2020 p.108",
        "retrieved": "2026-10-19"
      },
      "rule_status": "draft",
      "freshness": {
        "status": "unchecked",
        "url": null,
        "checked": null
      },
      "fix_by": null,
      "guidance_note": null
    },
    {
      "rule_id": "udcpr2020.ch6.max-fsi-congested",
      "title": "Maximum building potential (FSI) — congested area",
      "severity": "critical",
      "element": null,
      "status": "unverifiable",
      "measured": null,
      "limit": null,
      "message": "Cannot verify: needs site.edges, project.congested_area, project.overlays.metro_tod",
      "missing_inputs": [
        "site.edges",
        "project.congested_area",
        "project.overlays.metro_tod"
      ],
      "facts_used": [
        {
          "path": "project.congested_area",
          "value": null,
          "source": "default"
        },
        {
          "path": "project.occupancy",
          "value": {
            "group": "A",
            "subdivision": "A-2"
          },
          "source": "declared"
        },
        {
          "path": "project.overlays.metro_tod",
          "value": null,
          "source": "default"
        }
      ],
      "clause": {
        "ref": "Table No. 6-A (Regulation 6.1.1)",
        "excerpt": "The maximum permissible basic floor space index, FSI on payment of premium, permissible TDR loading shall be as per the following Table No.6-A.",
        "source": "udcpr2020 p.105",
        "retrieved": "2026-10-19"
      },
      "rule_status": "draft",
      "freshness": {
        "status": "unchecked",
        "url": null,
        "checked": null
      },
      "fix_by": null,
      "guidance_note": null
    },
    {
      "rule_id": "udcpr2020.ch6.max-fsi-noncongested",
      "title": "Maximum building potential (FSI) — non-congested area",
      "severity": "critical",
      "element": null,
      "status": "unverifiable",
      "measured": null,
      "limit": null,
      "message": "Cannot verify: needs site.edges, project.congested_area, project.overlays.metro_tod",
      "missing_inputs": [
        "site.edges",
        "project.congested_area",
        "project.overlays.metro_tod"
      ],
      "facts_used": [
        {
          "path": "project.congested_area",
          "value": null,
          "source": "default"
        },
        {
          "path": "project.overlays.metro_tod",
          "value": null,
          "source": "default"
        }
      ],
      "clause": {
        "ref": "Table 6-G (Regulation 6.3)",
        "excerpt": "Permissible basic FSI, additional FSI on payment of premium, Permissible TDR Loading on a plot in non-congested area for Residential and Residential with mixed uses and other buildings in developable zones like residential, commercial, public-semi-public etc. shall be as given in Table 6-G below.",
        "source": "udcpr2020 p.115",
        "retrieved": "2026-10-19"
      },
      "rule_status": "draft",
      "freshness": {
        "status": "unchecked",
        "url": null,
        "checked": null
      },
      "fix_by": null,
      "guidance_note": null
    },
    {
      "rule_id": "udcpr2020.ch6.side-rear-margin",
      "title": "Side and rear marginal distance (non-congested area)",
      "severity": "critical",
      "element": null,
      "status": "unverifiable",
      "measured": null,
      "limit": null,
      "message": "Cannot verify: needs site.boundary, site.edges",
      "missing_inputs": [
        "site.boundary",
        "site.edges"
      ],
      "facts_used": [],
      "clause": {
        "ref": "6.2.3 (b)",
        "excerpt": "For height more than stipulated in Table No.6-D / Table No.6-E, the marginal distance on all sides, except the front side of a building, shall be minimum H / 5 (Where H = Height of the building above ground level). Provided that, such marginal distance shall be subject to a maximum of 12.0 m. from the plot boundary.",
        "source": "udcpr2020 p.114",
        "retrieved": "2026-10-19"
      },
      "rule_status": "draft",
      "freshness": {
        "status": "unchecked",
        "url": null,
        "checked": null
      },
      "fix_by": null,
      "guidance_note": null
    },
    {
      "rule_id": "udcpr2020.ch9.exit-door-width",
      "title": "Minimum exit door width",
      "severity": "critical",
      "element": {
        "kind": "doors",
        "id": "D1",
        "source_id": "fx-dr-1"
      },
      "status": "pass",
      "measured": 1.0,
      "limit": 0.9,
      "message": "Exit door is 1.00 m wide; minimum is 0.90 m.",
      "missing_inputs": [],
      "facts_used": [
        {
          "path": "doors[D1].is_exit",
          "value": true,
          "source": "declared"
        },
        {
          "path": "project.occupancy",
          "value": {
            "group": "A",
            "subdivision": "A-2"
          },
          "source": "declared"
        }
      ],
      "clause": {
        "ref": "9.29.1 (ii)",
        "excerpt": "No exit doorway shall be less than 90 cm. in width except assembly buildings where door width shall be not less than 200 cm. Doorway shall be not less than 200 cm. in height.",
        "source": "udcpr2020 p.165",
        "retrieved": "2026-10-19"
      },
      "rule_status": "draft",
      "freshness": {
        "status": "unchecked",
        "url": null,
        "checked": null
      },
      "fix_by": null,
      "guidance_note": null
    },
    {
      "rule_id": "udcpr2020.ch9.exit-door-width",
      "title": "Minimum exit door width",
      "severity": "critical",
      "element": {
        "kind": "doors",
        "id": "D2",
        "source_id": "fx-dr-2"
      },
      "status": "not_applicable",
      "measured": null,
      "limit": null,
      "message": "Not applicable to this project.",
      "missing_inputs": [],
      "facts_used": [
        {
          "path": "doors[D2].is_exit",
          "value": false,
          "source": "inferred"
        }
      ],
      "clause": {
        "ref": "9.29.1 (ii)",
        "excerpt": "No exit doorway shall be less than 90 cm. in width except assembly buildings where door width shall be not less than 200 cm. Doorway shall be not less than 200 cm. in height.",
        "source": "udcpr2020 p.165",
        "retrieved": "2026-10-19"
      },
      "rule_status": "draft",
      "freshness": {
        "status": "unchecked",
        "url": null,
        "checked": null
      },
      "fix_by": null,
      "guidance_note": null
    },
    {
      "rule_id": "udcpr2020.ch9.stair-width-residential",